{
 "bundle_version": "2.0",
 "run_id": "fd-pi-validation-0-nominal-r2-rep_0-20260924T021900Z",
 "harness": "pi",
 "live": false,
 "exported_at": "2026-09-24T03:12:03+00:00",
 "run": {
  "stage": "validation",
  "clip_id": "0-nominal-r2",
  "replicate": 0,
  "agent_seed": 269318313,
  "applied_seed": 269318313,
  "layout_block": 17863,
  "candidate": null,
  "locked_pattern": null,
  "run_status": "completed",
  "agent_exit_code": 0,
  "created_at": "2026-09-24T02:19:00.960328+00:00",
  "finished_at": "2026-09-24T02:20:53.387603+00:00",
  "models": {
   "coder": {
    "model": "nemotron-3.5-lightning-30b-a3b",
    "revision": "bee7596271d1495f6992ae224aefde4410e816b8"
   },
   "vlm": {
    "model": "gemma-4-26b-a4b",
    "revision": "4d7ae4984b7db7de8f8457170b3f1a419ee76d52"
   }
  }
 },
 "task": {
  "question": "Which vehicles, if any, are travelling against traffic flow?",
  "oracle_exposed": false
 },
 "video": {
  "id": "0-nominal-r2",
  "duration_sec": 34.9,
  "fps": 10.0,
  "width": 960,
  "height": 540,
  "nb_frames": 349,
  "proxy": "video/0-nominal-r2.mp4"
 },
 "budget": {
  "limits": {
   "coarse_frames": 16,
   "dense_frames": 16,
   "vlm_inspected_frames": 32
  },
  "final": {
   "dense_frames": 16,
   "vlm_inspected_frames": 16
  }
 },
 "frames": [
  {
   "key": "<workspace>/coarse_scan/w_000_0.000s.jpg",
   "frame_id": 0,
   "t": 0.0,
   "file": "frames/000_w_000_0.000s.jpg",
   "window": "<workspace>/coarse_scan",
   "reason": "coarse scan start of video",
   "inspected": true,
   "cited": false,
   "observation": "The frame shows an empty asphalt road with white lane markings and a yellow line on the left edge. No vehicles are visible."
  },
  {
   "key": "<workspace>/coarse_scan/w_001_4.986s.jpg",
   "frame_id": 50,
   "t": 4.986,
   "file": "frames/001_w_001_4.986s.jpg",
   "window": "<workspace>/coarse_scan",
   "reason": "coarse scan start of video",
   "inspected": true,
   "cited": false,
   "observation": "The frame shows an empty asphalt road with white lane markings and a yellow line on the left edge. No vehicles are visible."
  },
  {
   "key": "<workspace>/scan_8_12/w_000_8.000s.jpg",
   "frame_id": 80,
   "t": 8.0,
   "file": null,
   "window": null,
   "reason": "sent to the VLM without an extraction index",
   "inspected": true,
   "cited": false,
   "observation": "An empty multi-lane road with white lane markings is visible."
  },
  {
   "key": "<workspace>/scan_8_12/w_001_9.333s.jpg",
   "frame_id": 93,
   "t": 9.333,
   "file": null,
   "window": null,
   "reason": "sent to the VLM without an extraction index",
   "inspected": true,
   "cited": false,
   "observation": "The road is empty."
  },
  {
   "key": "<workspace>/coarse_scan/w_002_9.971s.jpg",
   "frame_id": 100,
   "t": 9.971,
   "file": "frames/004_w_002_9.971s.jpg",
   "window": "<workspace>/coarse_scan",
   "reason": "coarse scan start of video",
   "inspected": true,
   "cited": false,
   "observation": "The frame shows an empty asphalt road with white lane markings and a yellow line on the left edge. No vehicles are visible."
  },
  {
   "key": "<workspace>/scan_8_12/w_002_10.667s.jpg",
   "frame_id": 107,
   "t": 10.667,
   "file": null,
   "window": null,
   "reason": "sent to the VLM without an extraction index",
   "inspected": true,
   "cited": false,
   "observation": "The road is empty."
  },
  {
   "key": "<workspace>/scan_8_12/w_003_12.000s.jpg",
   "frame_id": 120,
   "t": 12.0,
   "file": null,
   "window": null,
   "reason": "sent to the VLM without an extraction index",
   "inspected": true,
   "cited": false,
   "observation": "The road is empty."
  },
  {
   "key": "<workspace>/coarse_scan/w_003_14.957s.jpg",
   "frame_id": 150,
   "t": 14.957,
   "file": "frames/007_w_003_14.957s.jpg",
   "window": "<workspace>/coarse_scan",
   "reason": "coarse scan start of video",
   "inspected": true,
   "cited": false,
   "observation": "The frame shows an empty asphalt road with white lane markings and a yellow line on the left edge. No vehicles are visible."
  },
  {
   "key": "<workspace>/coarse_scan/w_004_19.943s.jpg",
   "frame_id": 199,
   "t": 19.943,
   "file": "frames/008_w_004_19.943s.jpg",
   "window": "<workspace>/coarse_scan",
   "reason": "coarse scan start of video",
   "inspected": true,
   "cited": false,
   "observation": "The frame shows an empty asphalt road with white lane markings and a yellow line on the left edge. No vehicles are visible."
  },
  {
   "key": "<workspace>/coarse_scan/w_005_24.929s.jpg",
   "frame_id": 249,
   "t": 24.929,
   "file": "frames/009_w_005_24.929s.jpg",
   "window": "<workspace>/coarse_scan",
   "reason": "coarse scan start of video",
   "inspected": true,
   "cited": false,
   "observation": "The frame shows an empty asphalt road with white lane markings and a yellow line on the left edge. No vehicles are visible."
  },
  {
   "key": "<workspace>/coarse_scan/w_006_29.914s.jpg",
   "frame_id": 299,
   "t": 29.914,
   "file": "frames/010_w_006_29.914s.jpg",
   "window": "<workspace>/coarse_scan",
   "reason": "coarse scan start of video",
   "inspected": true,
   "cited": false,
   "observation": "The frame shows an empty asphalt road with white lane markings and a yellow line on the left edge. No vehicles are visible."
  },
  {
   "key": "<workspace>/scan_mid/w_000_33.000s.jpg",
   "frame_id": 330,
   "t": 33.0,
   "file": "frames/011_w_000_33.000s.jpg",
   "window": "<workspace>/scan_mid",
   "reason": "scan middle of video",
   "inspected": true,
   "cited": false,
   "observation": "An empty paved road with white lane markings is visible."
  },
  {
   "key": "<workspace>/scan_mid/w_001_33.600s.jpg",
   "frame_id": 336,
   "t": 33.6,
   "file": "frames/012_w_001_33.600s.jpg",
   "window": "<workspace>/scan_mid",
   "reason": "scan middle of video",
   "inspected": true,
   "cited": false,
   "observation": "An empty paved road with white lane markings is visible."
  },
  {
   "key": "<workspace>/scan_mid/w_002_34.200s.jpg",
   "frame_id": 342,
   "t": 34.2,
   "file": "frames/013_w_002_34.200s.jpg",
   "window": "<workspace>/scan_mid",
   "reason": "scan middle of video",
   "inspected": true,
   "cited": false,
   "observation": "An empty paved road with white lane markings is visible."
  },
  {
   "key": "<workspace>/coarse_scan/w_007_34.800s.jpg",
   "frame_id": 348,
   "t": 34.8,
   "file": "frames/014_w_007_34.800s.jpg",
   "window": "<workspace>/coarse_scan",
   "reason": "coarse scan start of video",
   "inspected": true,
   "cited": false,
   "observation": "The frame shows an empty asphalt road with white lane markings and a yellow line on the left edge. No vehicles are visible."
  },
  {
   "key": "<workspace>/scan_mid/w_003_34.800s.jpg",
   "frame_id": 348,
   "t": 34.8,
   "file": "frames/015_w_003_34.800s.jpg",
   "window": "<workspace>/scan_mid",
   "reason": "scan middle of video",
   "inspected": true,
   "cited": false,
   "observation": "An empty paved road with white lane markings is visible."
  }
 ],
 "windows": [
  {
   "dir": "<workspace>/coarse_scan",
   "window": [
    0.0,
    34.9
   ],
   "reason": "coarse scan start of video",
   "count": 8
  },
  {
   "dir": "<workspace>/scan_mid",
   "window": [
    33.0,
    34.8
   ],
   "reason": "scan middle of video",
   "count": 4
  }
 ],
 "events": [
  {
   "t": 0.0,
   "type": "run.start"
  },
  {
   "t": 2.077,
   "type": "step.begin"
  },
  {
   "t": 2.077,
   "type": "tool.call",
   "tool": "read",
   "args": {
    "path": "<workspace>/input/task.json"
   }
  },
  {
   "t": 2.095,
   "type": "tool.result",
   "tool": "read",
   "ok": true,
   "detail": "{\n  \"schema_version\": 1,\n  \"sample_id\": \"wrong-way-0-nominal-r2\",\n  \"clip_id\": \"0-nominal-r2\",\n  \"video_path\": \"video.mp4\",\n  \"question\": \"Which vehicles, if any, are travelling against traffic flow?\",\n  \"oracle_exposed\": false,\n  \"video\": {\n    \"fps\": 10.0,\n    \"frames\": 349,\n    \"width\": 960,\n    \"height\": 540\n  }\n}"
  },
  {
   "t": 2.845,
   "type": "step.begin"
  },
  {
   "t": 2.845,
   "type": "tool.call",
   "tool": "bash",
   "args": {
    "command": "ls -la <workspace>/"
   }
  },
  {
   "t": 2.884,
   "type": "tool.result",
   "tool": "bash",
   "ok": true,
   "detail": "total 1440\ndrwxr-xr-x 7 phase0agent phase0agent    4096 Sep 24 02:19 .\ndrwxr-xr-x 7 root        root           4096 Sep 24 02:19 ..\ndrwxr-xr-x 7 phase0agent phase0agent    4096 Sep 24 02:19 .git\ndrwxr-xr-x 2 phase0agent phase0agent    4096 Sep 24 02:19 .pi\n-rw-r--r-- 1 phase0agent phase0agent    1060 Sep 11 02:35 AGENTS.md\ndrwxr-xr-x 2 phase0agent phase0agent    4096 Sep 24 02:19 config\ndrwxr-xr-x 2 phase0agent phase0agent    4096 Sep 24 02:19 input\n-rw-r--r-- 1 phase0agent phase0agent     320 Sep 24 02:19 input-task.json\ndrwxr-xr-x 2 phase0agent phase0agent    4096 Sep 21 21:54 tools\n-rw-rw-r-- 1 phase0agent phase0agent 1434526 Sep 10 20:05 video.mp4"
  },
  {
   "t": 3.722,
   "type": "step.begin"
  },
  {
   "t": 3.722,
   "type": "tool.call",
   "tool": "bash",
   "args": {
    "command": "ls -la <workspace>/tools/"
   }
  },
  {
   "t": 3.747,
   "type": "tool.result",
   "tool": "bash",
   "ok": true,
   "detail": "total 64\ndrwxr-xr-x 2 phase0agent phase0agent  4096 Sep 21 21:54 .\ndrwxr-xr-x 7 phase0agent phase0agent  4096 Sep 24 02:19 ..\n-rw-r--r-- 1 phase0agent phase0agent  7534 Sep 23 23:19 _budget.py\n-rw-r--r-- 1 phase0agent phase0agent  4712 Sep 11 03:33 _common.py\n-rw-r--r-- 1 phase0agent phase0agent  7788 Sep 11 03:33 crv_prepare.py\n-rw-r--r-- 1 phase0agent phase0agent  6436 Sep 24 02:00 extract_window.py\n-rw-r--r-- 1 phase0agent phase0agent  2524 Sep 11 01:56 probe_video.py\n-rw-r--r-- 1 phase0agent phase0agent  1458 Sep 11 02:24 submit_evidence.py\n-rw-r--r-- 1 phase0agent phase0agent 14881 Sep 23 16:19 vlm_inspect.py"
  },
  {
   "t": 4.614,
   "type": "step.begin"
  },
  {
   "t": 4.614,
   "type": "tool.call",
   "tool": "read",
   "args": {